{
  "name": "Budibase",
  "port": 8268,
  "available": true,
  "exposable": true,
  "dynamic_config": true,
  "id": "budibase",
  "tipi_version": 401,
  "version": "v3.49.0",
  "categories": ["development"],
  "description": "Low code platform for creating internal tools, workflows, and admin panels in minutes. Supports PostgreSQL, MySQL, MSSQL, MongoDB, Rest API, Docker, K8s, and more 🚀. Budibase, the low code platform you'll enjoy using ⚡",
  "short_desc": "Internal tools made easy.",
  "author": "Budibase",
  "source": "https://github.com/Budibase/budibase",
  "website": "https://budibase.com/",
  "form_fields": [],
  "supported_architectures": ["arm64", "amd64"],
  "created_at": 1691943801422,
  "updated_at": 1791796363456,
  "min_tipi_version": "4.5.0"
}
