{
  "$schema": "https://schemas.runtipi.io/v2/app-info.json",
  "name": "RSSHub",
  "id": "rsshub",
  "available": true,
  "short_desc": "Everything is RSSible with RSSHub",
  "author": "DIYgod",
  "port": 8223,
  "categories": ["utilities", "media"],
  "description": "RSSHub is an open source, easy to use, and extensible RSS feed generator. It's capable of generating RSS feeds from pretty much everything.",
  "tipi_version": 153,
  "version": "2026-10-26",
  "source": "https://github.com/DIYgod/RSSHub",
  "website": "https://docs.rsshub.app/",
  "exposable": true,
  "supported_architectures": ["amd64", "arm64"],
  "created_at": 1691943801422,
  "updated_at": 1793033720284,
  "dynamic_config": true,
  "min_tipi_version": "4.5.0",
  "form_fields": [
    {
      "type": "text",
      "label": "Timezone",
      "required": false,
      "env_variable": "RSSHUB_TZ",
      "default": "Europe/Rome",
      "hint": "Container timezone (e.g., America/New_York, Europe/Berlin)"
    },
    {
      "type": "password",
      "label": "Access Key",
      "max": 256,
      "min": 4,
      "required": false,
      "env_variable": "ACCESS_KEY",
      "hint": "Global access key to restrict feed generation (leave empty for open access)"
    },
    {
      "type": "text",
      "label": "GitHub Token",
      "required": false,
      "env_variable": "GITHUB_ACCESS_TOKEN",
      "hint": "GitHub personal access token for GitHub routes"
    },
    {
      "type": "text",
      "label": "YouTube API Key",
      "required": false,
      "env_variable": "YOUTUBE_KEY",
      "hint": "YouTube Data API v3 key for YouTube routes"
    },
    {
      "type": "text",
      "label": "Telegram Bot Token",
      "required": false,
      "env_variable": "TELEGRAM_TOKEN",
      "hint": "Telegram bot token for Telegram routes"
    },
    {
      "type": "text",
      "label": "Twitter/X Auth Token",
      "required": false,
      "env_variable": "TWITTER_AUTH_TOKEN",
      "hint": "Twitter/X auth token for Twitter routes (requires valid account)"
    },
    {
      "type": "text",
      "label": "User Agent",
      "required": false,
      "env_variable": "UA",
      "hint": "Custom User-Agent string for HTTP requests (leave empty for default Mozilla UA)"
    },
    {
      "type": "text",
      "label": "Proxy URI",
      "required": false,
      "env_variable": "PROXY_URI",
      "hint": "Optional: Enable proxy to bypass 403 errors. Recommended: install 'sing-box' app and use http://singbox:8888, or provide custom proxy URL. Leave empty to disable."
    }
  ]
}
