{
  "$schema": "https://schemas.runtipi.io/v2/app-info.json",
  "name": "Workout Cool",
  "id": "workout-cool",
  "available": true,
  "short_desc": "Modern open-source fitness coaching platform",
  "author": "Snouzy",
  "port": 3000,
  "categories": ["utilities"],
  "description": "Modern fitness coaching platform to create workout plans, track progress, and access a comprehensive exercise database with detailed instructions and video demonstrations.",
  "tipi_version": 1,
  "version": "1.3.2",
  "source": "https://github.com/Snouzy/workout-cool",
  "website": "https://workout.cool",
  "exposable": true,
  "supported_architectures": ["arm64", "amd64"],
  "created_at": 1734184800000,
  "updated_at": 1734184800000,
  "dynamic_config": true,
  "min_tipi_version": "4.5.0",
  "form_fields": [
    {
      "type": "random",
      "label": "Auth Secret",
      "required": true,
      "env_variable": "BETTER_AUTH_SECRET",
      "min": 32
    },
    {
      "type": "random",
      "label": "Database Password",
      "required": true,
      "env_variable": "DB_PASSWORD",
      "min": 24
    },
    {
      "type": "boolean",
      "label": "Seed Sample Data",
      "required": false,
      "env_variable": "SEED_SAMPLE_DATA",
      "default": true,
      "hint": "Populate the database with sample exercises on first start"
    }
  ]
}
