{
  "$schema": "https://schemas.runtipi.io/v2/app-info.json",
  "name": "Puter",
  "id": "puter",
  "available": true,
  "short_desc": "Self-hosted cloud computer",
  "author": "HeyPuter",
  "port": 4100,
  "categories": ["utilities"],
  "description": "Puter is a self-hosted cloud computer that brings desktop-like file management, apps, and sharing to your browser.",
  "tipi_version": 12,
  "version": "26.10.1",
  "source": "https://github.com/HeyPuter/puter",
  "website": "https://puter.com/",
  "exposable": true,
  "supported_architectures": ["arm64", "amd64"],
  "created_at": 1771286400000,
  "updated_at": 1792947310590,
  "dynamic_config": true,
  "min_tipi_version": "4.5.0",
  "form_fields": [
    {
      "type": "text",
      "label": "Timezone",
      "required": false,
      "env_variable": "TZ",
      "default": "Europe/Rome",
      "hint": "Timezone for the application (e.g. Europe/Rome, America/New_York)"
    }
  ]
}
