{
  "name": "n8n",
  "available": true,
  "exposable": true,
  "dynamic_config": true,
  "port": 5678,
  "id": "n8n",
  "tipi_version": 130,
  "version": "2.44.2",
  "categories": ["automation"],
  "description": "n8n is an extendable workflow automation tool. With a fair-code distribution model, n8n will always have visible source code, be available to self-host, and allow you to add your own custom functions, logic and apps. n8n's node-based approach makes it highly versatile, enabling you to connect anything to everything.",
  "short_desc": "Workflow Automation Tool. Alternative to Zapier",
  "author": "n8n.io",
  "source": "https://github.com/n8n-io/n8n",
  "website": "https://n8n.io/",
  "form_fields": [
    {
      "type": "random",
      "label": "Encryption Key",
      "min": 32,
      "env_variable": "N8N_ENCRYPTION_KEY"
    },
    {
      "type": "random",
      "label": "Database Password",
      "min": 32,
      "env_variable": "N8N_DB_PASSWORD"
    },
    {
      "type": "random",
      "label": "Database Non Root Password",
      "min": 32,
      "env_variable": "N8N_NR_DB_PASSWORD"
    },
    {
      "type": "random",
      "label": "Redis Password",
      "min": 32,
      "env_variable": "N8N_REDIS_PASSWORD"
    },
    {
      "type": "random",
      "label": "Task Runner Auth Token",
      "min": 32,
      "env_variable": "N8N_RUNNERS_AUTH_TOKEN"
    },
    {
      "type": "text",
      "label": "Timezone",
      "required": false,
      "env_variable": "N8N_GENERIC_TIMEZONE",
      "default": "Europe/Rome",
      "hint": "Timezone for workflows and cron triggers (e.g. Europe/Rome, America/New_York)"
    },
    {
      "type": "text",
      "label": "Enable Diagnostics",
      "required": false,
      "env_variable": "N8N_DIAGNOSTICS_ENABLED",
      "default": "false",
      "hint": "Send anonymous usage data to n8n (true/false)"
    },
    {
      "type": "text",
      "label": "Version Notifications",
      "required": false,
      "env_variable": "N8N_VERSION_NOTIFICATIONS_ENABLED",
      "default": "false",
      "hint": "Show update notifications in the UI (true/false)"
    },
    {
      "type": "text",
      "label": "Enable Templates",
      "required": false,
      "env_variable": "N8N_TEMPLATES_ENABLED",
      "default": "true",
      "hint": "Show workflow templates in the UI (true/false)"
    },
    {
      "type": "text",
      "label": "Allowed External Modules",
      "required": false,
      "env_variable": "N8N_NODE_FUNCTION_ALLOW_EXTERNAL",
      "default": "*",
      "hint": "External npm modules allowed in Code nodes. Use * for all, or comma-separated list (e.g. moment,lodash,axios)"
    }
  ],
  "supported_architectures": ["arm64", "amd64"],
  "created_at": 1691943801422,
  "updated_at": 1791996991333,
  "min_tipi_version": "4.5.0"
}
