{
  "$schema": "https://schemas.runtipi.io/v2/app-info.json",
  "name": "wger",
  "id": "wger",
  "available": true,
  "short_desc": "Self-hosted fitness and workout tracking application",
  "author": "wger Project",
  "port": 8000,
  "categories": ["utilities"],
  "description": "wger is a free, open-source web application that helps you manage your personal workouts, weight, and diet plans. It includes a REST API for integrations and mobile apps.",
  "tipi_version": 2,
  "version": "2.4-dev",
  "source": "https://github.com/wger-project/wger",
  "website": "https://wger.de",
  "exposable": true,
  "supported_architectures": ["arm64", "amd64"],
  "created_at": 1734278400000,
  "updated_at": 1734278400000,
  "dynamic_config": true,
  "min_tipi_version": "4.5.0",
  "form_fields": [
    {
      "type": "random",
      "label": "Secret Key",
      "required": true,
      "env_variable": "SECRET_KEY",
      "min": 50,
      "hint": "Django secret key for cryptographic signing"
    },
    {
      "type": "random",
      "label": "JWT Signing Key",
      "required": true,
      "env_variable": "SIGNING_KEY",
      "min": 50,
      "hint": "JWT signing key (should differ from Secret Key)"
    },
    {
      "type": "random",
      "label": "Database Password",
      "required": true,
      "env_variable": "DB_PASSWORD",
      "min": 24
    },
    {
      "type": "text",
      "label": "Timezone",
      "required": false,
      "env_variable": "TIME_ZONE",
      "default": "Europe/Rome",
      "hint": "Server timezone (e.g., America/New_York, Europe/Berlin)"
    },
    {
      "type": "boolean",
      "label": "Allow Registration",
      "required": false,
      "env_variable": "ALLOW_REGISTRATION",
      "default": true,
      "hint": "Allow new users to register"
    },
    {
      "type": "boolean",
      "label": "Allow Guest Users",
      "required": false,
      "env_variable": "ALLOW_GUEST_USERS",
      "default": true,
      "hint": "Allow guest access without registration"
    }
  ]
}
