{
  "$schema": "https://schemas.runtipi.io/v2/app-info.json",
  "name": "RSS-Bridge",
  "id": "rss-bridge",
  "available": true,
  "short_desc": "Generate RSS feeds for websites that don't have one",
  "author": "RSS-Bridge",
  "port": 3001,
  "categories": ["utilities"],
  "description": "RSS-Bridge is a PHP web application that generates RSS/Atom feeds for websites that don't provide one. It supports over 400 bridges for popular sites including YouTube, Twitter, Reddit, Instagram, and many more.",
  "tipi_version": 57,
  "version": "latest",
  "source": "https://github.com/RSS-Bridge/rss-bridge",
  "website": "https://rss-bridge.org",
  "exposable": true,
  "supported_architectures": ["arm64", "amd64"],
  "created_at": 1739487600000,
  "updated_at": 1792501227484,
  "dynamic_config": true
}
