{
  "$schema": "https://schemas.runtipi.io/v2/app-info.json",
  "name": "NocoBase",
  "id": "nocobase",
  "available": true,
  "short_desc": "Extensible open-source no-code/low-code platform for building business applications",
  "author": "NocoBase",
  "port": 13000,
  "categories": ["development"],
  "description": "NocoBase is the most extensible open-source no-code/low-code platform for building business applications and enterprise solutions. Create forms, dashboards, workflows, and more without writing code.",
  "tipi_version": 110,
  "version": "2.2.37-full",
  "source": "https://github.com/nocobase/nocobase",
  "website": "https://www.nocobase.com",
  "exposable": true,
  "supported_architectures": ["arm64", "amd64"],
  "created_at": 1739577600000,
  "updated_at": 1793441040165,
  "dynamic_config": true,
  "min_tipi_version": "4.5.0",
  "form_fields": [
    {
      "type": "random",
      "label": "App Key",
      "env_variable": "APP_KEY",
      "min": 32
    },
    {
      "type": "random",
      "label": "Database Password",
      "env_variable": "DB_PASSWORD",
      "min": 24
    },
    {
      "type": "text",
      "label": "Timezone",
      "required": false,
      "env_variable": "TZ",
      "default": "Europe/Rome",
      "hint": "Timezone for the application (e.g. Europe/Rome, America/New_York)"
    }
  ]
}
