{
  "$schema": "https://schemas.runtipi.io/v2/app-info.json",
  "name": "ChangeDetection",
  "id": "changedetection",
  "available": true,
  "short_desc": "Website change detection, monitoring and notification.",
  "author": "dgtlmoon",
  "port": 8257,
  "categories": ["utilities"],
  "description": "The best and simplest free open source website change detection, restock monitor and notification service. Bundled with a sockpuppetbrowser sidecar for JavaScript rendering, the Visual Selector and Browser Steps.",
  "tipi_version": 11,
  "version": "0.60.10",
  "source": "https://github.com/dgtlmoon/changedetection.io",
  "website": "https://changedetection.io/",
  "exposable": true,
  "supported_architectures": ["arm64", "amd64"],
  "created_at": 1691943801422,
  "updated_at": 1793033728689,
  "dynamic_config": true,
  "min_tipi_version": "4.5.0"
}
