{
  "$schema": "../app-info-schema.json",
  "name": "Forgejo",
  "port": 8195,
  "available": true,
  "exposable": true,
  "dynamic_config": true,
  "id": "forgejo",
  "tipi_version": 37,
  "version": "16.0.6",
  "categories": ["development"],
  "description": "Forgejo is a self-hosted lightweight software forge. Easy to install and low maintenance, it just does the job. This package ships Forgejo Actions enabled with a self-hosted runner that auto-registers on first boot (Docker-in-Docker executor), giving you built-in CI/CD without any manual setup.",
  "short_desc": "Beyond coding. We forge. · Lightweight software forge with built-in Actions CI/CD",
  "author": "forgejo",
  "source": "https://codeberg.org/forgejo/forgejo/",
  "form_fields": [
    {
      "type": "random",
      "label": "FORGEJO_DB_PASSWORD",
      "min": 32,
      "env_variable": "FORGEJO_DB_PASSWORD"
    },
    {
      "type": "random",
      "label": "Actions runner secret seed",
      "min": 32,
      "env_variable": "FORGEJO_RUNNER_SECRET"
    }
  ],
  "supported_architectures": ["arm64", "amd64"],
  "created_at": 1783617055000,
  "updated_at": 1792205397363,
  "min_tipi_version": "4.5.0"
}
